,title,series_id,episode_id,season,episode,rating,votes,original_air_date,year,plot,series_title,episode_title
178,Scents and Sensei-bility,tt0397306,tt4134632,10,3,6.9,306.0,2014-11-03,2014,"
    Steve and Snot's friendship is put to the test when Snot joins a karate class, and the rest of the Smith family makes Klaus an ""outside fish.""    ",American Dad!,Scents and Sensei-bility
179,Big Stan on Campus,tt0397306,tt4134636,10,4,7.2,455.0,2014-11-10,2014,"
    On furlough from work, Stan takes a temporary job as a security guard for a community college. Meanwhile, Roger tries to earn extra money for the family by turning the house into an inn.    ",American Dad!,Big Stan on Campus
180,Now and Gwen,tt0397306,tt4134638,10,5,7.5,309.0,2014-11-17,2014,"
    Francine's trouble-making sister, Gwen, comes to live with the family and her arrival dredges up a long-buried secret from Francine's past.    ",American Dad!,Now and Gwen
181,Dreaming of a White Porsche Christmas,tt0397306,tt4132636,10,6,7.4,335.0,2014-12-01,2014,"
    Stan grows tired of his daily responsibilities and makes a Christmas wish to swap lives with the free-spirited Principal Lewis.    ",American Dad!,Dreaming of a White Porsche Christmas
182,LGBSteve,tt0397306,tt4297606,10,7,7.4,331.0,2015-02-23,2015,"
    Haley and Steve join an all girl Rollerblading team, while Stan and Francine get a visit from an all knowing gardener.    ",American Dad!,LGBSteve
183,Morning Mimosa,tt0397306,tt4474850,10,8,7.3,316.0,2015-03-02,2015,"
    Steve seeks his independence from Francine by becoming an online video cooking sensation.    ",American Dad!,Morning Mimosa
184,My Affair Lady,tt0397306,tt4474852,10,9,7.3,414.0,2015-03-09,2015,"
    Hayley considers having an affair with a married man, but what about Jeff?    ",American Dad!,My Affair Lady
185,A Star Is Reborn,tt0397306,tt4474854,10,10,7.0,305.0,2015-03-16,2015,"
    Stan and Francine travel to Hollywood for vacation. An aging movie star believes Stan is the reincarnation of a Hollywood legend and uses him to make one last film.    ",American Dad!,A Star Is Reborn
186,Manhattan Magical Murder Mystery Tour,tt0397306,tt4474856,10,11,7.1,282.0,2015-03-23,2015,"
    Francine becomes a successful self-published mystery novelist and the family travels to New York to attend a convention.    ",American Dad!,Manhattan Magical Murder Mystery Tour
187,The Shrink,tt0397306,tt4474866,10,12,7.3,278.0,2015-03-30,2015,"
    Stan is traumatized by a random act of violence and seeks to establish a sense of control by creating a miniature version of Langley Falls.    ",American Dad!,The Shrink
188,"Holy Shit, Jeff's Back",tt0397306,tt4657498,10,13,7.6,293.0,2015-05-18,2015,"
    Jeff has escaped from space, or has he?    ",American Dad!,"Holy Shit, Jeff's Back"
189,American Fung,tt0397306,tt4657500,10,14,4.0,1103.0,2015-05-25,2015,"
    A Chinese billionaire purchases the ""American Dad!"" TV show and remakes it as he sees fit.    ",American Dad!,American Fung
190,Seizures Suit Stanny,tt0397306,tt4669158,10,15,7.0,369.0,2015-06-01,2015,"
    Stan suffers the drastic side effects of taking a seizure medication.    ",American Dad!,Seizures Suit Stanny
191,Roots,tt0397306,tt4132640,11,1,7.0,282.0,2016-01-25,2016,"
    Stan opposes the building of a new arena football stadium because his ""tree father"" will be cut down. Klaus recommends a specialist for Steve to help him become taller.    ",American Dad!,Roots
192,The Life Aquatic with Steve Smith,tt0397306,tt5328852,11,2,7.4,276.0,2016-02-01,2016,"
    With the help of Klaus, Steve becomes the star of the high school water polo team. But when Steve takes all the credit for his greatness to impress a girl, Klaus vows revenge.    ",American Dad!,The Life Aquatic with Steve Smith
193,"Hayley Smith, Seal Team Six",tt0397306,tt5328858,11,3,7.3,248.0,2016-02-08,2016,"
    Roger uses hypnosis to send Hayley back to six-year-old ""Happy Haley,"" but Jeff and Klaus want the old Haley back. Steve and his friends get a slow cooker to cook some pork.    ",American Dad!,"Hayley Smith, Seal Team Six"
194,N.S.A. (No Snoops Allowed),tt0397306,tt5372660,11,4,7.1,242.0,2016-02-15,2016,"
    After Stan embarrasses Steve at work, Steve decides to sell him out to his rivals at the NSA. Roger convinces Hayley to go on a 24-hour meat-eating binge.    ",American Dad!,N.S.A. (No Snoops Allowed)
195,Stan Smith Is Keanu Reeves as Stanny Utah in Point Break,tt0397306,tt5372662,11,5,7.1,237.0,2016-02-22,2016,"
    Home issues cause Stan to stress out, so he decides to take a job investigating a group of surfers to get away from everything.    ",American Dad!,Stan Smith Is Keanu Reeves as Stanny Utah in Point Break
196,Kiss Kiss Cam Cam,tt0397306,tt5372666,11,6,6.8,225.0,2016-02-29,2016,"
    An embarrassing moment on the Kiss Cam causes Stan to realize that he and Francine have nothing in common. Roger revives a Nevada politician persona to take down a company polluting the water supply.    ",American Dad!,Kiss Kiss Cam Cam
197,The Devil Wears a Lapel Pin,tt0397306,tt5372668,11,7,7.2,223.0,2016-03-07,2016,"
    Haley tries to get revenge on Stan for a childhood drawing he destroyed while Roger goes all out to get a jacket with reward points.    ",American Dad!,The Devil Wears a Lapel Pin
198,Stan-Dan Deliver,tt0397306,tt5372670,11,8,7.1,230.0,2016-03-14,2016,"
    Roger becomes a teacher for inner city kids while Stan and Francine figure out their retirement plans.    ",American Dad!,Stan-Dan Deliver
199,Anchorfran,tt0397306,tt5522848,11,9,7.4,232.0,2016-03-21,2016,"
    Francine helps Greg out with the news and becomes a news anchor. In the meantime Roger, Haley and Steve set out to find a boy pictured in a 1990's board game.    ",American Dad!,Anchorfran
200,The Two Hundred,tt0397306,tt5372672,11,10,8.5,419.0,2016-03-28,2016,"
    Stan journeys through a post apocalyptic world in search for his family.    ",American Dad!,The Two Hundred
201,The Unincludeds,tt0397306,tt5372664,11,11,8.0,278.0,2016-04-11,2016,"
    Steve and Snot alter their futures and throw a party for the uncool kids, meanwhile Roger is disgruntled when a waitress doesn't compliment his order.    ",American Dad!,The Unincludeds
202,The Dentist's Wife,tt0397306,tt5522860,11,12,7.2,235.0,2016-04-18,2016,"
    Roger loses his identity after becoming fascinated by a local dentist'?s wife. Meanwhile, Klaus throws a party when Stan and the kids are unable to move from being sore after working out.    ",American Dad!,The Dentist's Wife
203,Widow's Pique,tt0397306,tt4746392,11,13,7.0,217.0,2016-04-25,2016,"
    Francine comes to reality with her future fate as a widow considering Stan's dangerous job. Steve and the boys pretend to be professional wrestlers, until principal Lewis ruins their fun.    ",American Dad!,Widow's Pique
204,The Nova Centauris-burgh Board of Tourism Presents: American Dad,tt0397306,tt5522862,11,14,7.3,217.0,2016-05-02,2016,"
    Steve's live-action role-playing fun with his friends is spoiled when Francine decides to play along. Stan and Roger decide to create a theme park in their home after Stan brings home a pet shark.    ",American Dad!,The Nova Centauris-burgh Board of Tourism Presents: American Dad
205,Daesong Heavy Industries,tt0397306,tt4132644,11,15,7.3,241.0,2016-05-09,2016,"
    Stan loses his faith in religion after Steve questions everything in the Bible. He takes the family to Korea to investigate the rumors of a reinvented Noah'?s Ark.    ",American Dad!,Daesong Heavy Industries
206,Daesong Heavy Industries II: Return to Innocence,tt0397306,tt5012452,11,16,7.1,234.0,2016-05-16,2016,"
    Stan takes the family to church and Steve questions everything. Stan decides to help Steve develop some faith, but the plan backfires when Steve points out logical flaws with faith and religion. Stan spirals into a deep depression where he attempts to find pleasure and meaning in life, but finds none. When Stan almost drowns in a pool he has a vision of God. Stan believes that he is the new Noah and that he must get his family to an ark in order to survive the flood.    ",American Dad!,Daesong Heavy Industries II: Return to Innocence
207,Criss-Cross Applesauce: The Ballad of Billy Jesusworth,tt0397306,tt5563218,11,17,7.3,304.0,2016-05-23,2016,"
    Steve narrates his day, in the style of ""Trapped in the Closet"" by R. Kelly; Roger's basketball playing persona, ""Billy Jesusworth"" and Stan play against each other in a basketball tournament.    ",American Dad!,Criss-Cross Applesauce: The Ballad of Billy Jesusworth
208,Mine Struggle,tt0397306,tt4893268,11,18,7.2,253.0,2016-05-30,2016,"
    Stan discovers a salt mine in the backyard, but Steve turns out to be the rightful owner of the land, and faces pressure from the family to sell out.    ",American Dad!,Mine Struggle
209,Garfield and Friends,tt0397306,tt5737686,11,19,7.0,206.0,2016-06-06,2016,"
    Stan tries to get Hayley to learn something about history. Meanwhile, Steve becomes an author for the school newspaper.    ",American Dad!,Garfield and Friends
210,Gifted Me Liberty,tt0397306,tt5737690,11,20,7.5,202.0,2016-06-13,2016,"
    Stan tries to crack down on whoever did not bring a present to the C.I.A. Christmas party; Steve poses as a boyfriend for several female classmates.    ",American Dad!,Gifted Me Liberty
211,Next of Pin,tt0397306,tt5737702,11,21,7.4,197.0,2016-06-20,2016,"
    Stan and Steve enter a father son bowling tournament, while Roger and Hailey try to prove who has the better attention span.    ",American Dad!,Next of Pin
212,Standard Deviation,tt0397306,tt5737710,11,22,6.9,190.0,2016-06-27,2016,"
    Stan is afraid that Hayley is drifting aimlessly through life, so he tries to teach her the value of a good plan. Stan takes Hayley on a CIA mission, but the mission backfires when Bullock fails to develop a good plan. Hayley discovers that Bullock is sleep-deprived which is leading him to plan dangerous missions. In order to save Stan, Hayley must teach him how to improvise. Meanwhile, Jeff tries to recreate a musical instrument he saw in a dream.    ",American Dad!,Standard Deviation
213,Father's Daze,tt0397306,tt5527362,12,1,7.5,236.0,2016-11-07,2016,"
    Stan keeps erasing his family's memories, forcing them to redo Father's Day until they get it right.    ",American Dad!,Father's Daze
214,Fight and Flight,tt0397306,tt5780922,12,2,6.8,218.0,2016-11-14,2016,"
    Stan helps Steve to go above and beyond on his history project, fearing Steve may be losing his smarts. Meanwhile, Klaus longs for a human body again someday.    ",American Dad!,Fight and Flight
215,The Enlightenment of Ragi-Baba,tt0397306,tt5780930,12,3,7.0,199.0,2016-11-21,2016,"
    Stan and Steve become sushi chefs while Haley tries to help Roger seek peace through meditation.    ",American Dad!,The Enlightenment of Ragi-Baba
216,Portrait of Francine's Genitals,tt0397306,tt5780926,12,4,6.7,208.0,2016-11-28,2016,"
    Stan becomes outraged when a painting of Francine's genitalia is placed in a museum.    ",American Dad!,Portrait of Francine's Genitals
217,Bahama Mama,tt0397306,tt6188994,12,5,7.3,199.0,2016-12-05,2016,"
    Stan gets upset at the idea of becoming a grandfather after Haley and Jeff are trying to have a baby, Steve and Klaus join a drug gang.    ",American Dad!,Bahama Mama
218,Roger's Baby,tt0397306,tt6189002,12,6,7.1,196.0,2016-12-12,2016,"
    Roger agrees to give birth to Jeff so he can be human again; Steve secretly signs Snot up for a makeover.    ",American Dad!,Roger's Baby
219,"Ninety North, Zero West",tt0397306,tt6189004,12,7,7.2,214.0,2016-12-19,2016,"
    The Smiths rescue Steve after he's kidnapped and taken to the North Pole, where Santa Claus is using children to mine for precious stones needed for an ancient ritual.    ",American Dad!,"Ninety North, Zero West"
220,A Whole Slotta Love,tt0397306,tt6504590,12,8,6.9,193.0,2017-04-10,2017,"
    When Francine finds out that Stan is involved with slot car racing, she becomes less attracted to him. Meanwhile Roger becomes a stewardess and performs comedy routines on planes and gets mad when people find the other stewardess funnier.    ",American Dad!,A Whole Slotta Love
221,The Witches of Langley,tt0397306,tt6374518,12,9,7.1,190.0,2017-04-17,2017,"
    Steve and his friends take up witchcraft to gain popularity at school, meanwhile Stan and Klaus become interested in old 90's music.    ",American Dad!,The Witches of Langley
222,A Nice Night for a Drive,tt0397306,tt6504592,12,10,6.8,182.0,2017-04-24,2017,"
    Klaus gets transferred into the navigation system of Stan's car after Stan refuses to pay for a life-saving surgery. Steve and his friends prank Roger's Frank character and he terrorizes them for revenge.    ",American Dad!,A Nice Night for a Drive
223,Casino Normale,tt0397306,tt6504594,12,11,7.1,257.0,2017-05-01,2017,"
    Francine steals from the CIA and pretends to be a sexy supervillain to incite Stan to be more seductive. Roger tricks Hayley and Steve into trapping Jay Leno so he can take revenge on him.    ",American Dad!,Casino Normale
224,Bazooka Steve,tt0397306,tt6504598,12,12,6.7,168.0,2017-05-29,2017,"
    Steve becomes the most hated person in town after he convinces the star quarterback player of the Bazooka Sharks to quit. Meanwhile Haley is forced to become a cab driver to pay Roger's gambling debt.    ",American Dad!,Bazooka Steve
225,Camp Campawanda,tt0397306,tt6504600,12,13,6.6,172.0,2017-06-05,2017,"
    Steve and Snot go to summer camp, but each wants something different out of the experience. Meanwhile, Roger organizes a ""Burning Man"" in the Smith's backyard for the anniversary of Hayley and Jeff. Stan and Francine get caught up in the celebration.    ",American Dad!,Camp Campawanda
226,Julia Rogerts,tt0397306,tt6834968,12,14,7.2,313.0,2017-06-12,2017,"
    Roger runs off in disguise as a Julia Roberts character to a small town after Stan hurts his feelings. Steve plans a meeting when he finds out that Jeff and Barry have never met.    ",American Dad!,Julia Rogerts
227,The Life and Times of Stan Smith,tt0397306,tt6834970,12,15,7.3,257.0,2017-07-24,2017,"
    The family gathers to hear the results of Stan's annual physical. The doctor reveals that Stan is not taking care of himself and orders him to live a healthier life. Stan is stubborn, so Roger and Francine conspire to scare Stan with a near death experience. Stan becomes addicted to the near death experience when he watches his life flash before his eyes. Meanwhile, Klaus takes Steve on a tour of a university.    ",American Dad!,The Life and Times of Stan Smith
228,The Bitchin' Race,tt0397306,tt6834972,12,16,6.6,186.0,2017-07-31,2017,"
    The Smith family is participating in televised race that takes them all over the globe. Stan and Hayley are frustrated that their teammates don't take the race seriously. Steve and Francine try to turn the race into a vacation, while Roger abandons the race to enjoy karaoke. Stan and Hayley abandon their teams and attempt to complete the race on their own. Meanwhile, Klaus watches the race as it unfolds on television.    ",American Dad!,The Bitchin' Race
229,Family Plan,tt0397306,tt6834974,12,17,6.2,188.0,2017-08-07,2017,"
    Francine dreams of having a larger family and wonders if being adopted has affected her view of families. Hayley encourages Francine to track down her birth parents. Francine finds her family and attends a family reunion. At the union, the family patron decides to whittle his large family down by trapping them on the property and forcing them to fight each other. Meanwhile, Stan becomes obsessed with the TV show ""American Pickers"".    ",American Dad!,Family Plan
230,The Long Bomb,tt0397306,tt6834976,12,18,6.7,178.0,2017-08-14,2017,"
    Despite poor communication between the two, can Stan and Hayley team up to foil a terrorist plot at the Bazooka Sharks game?    ",American Dad!,The Long Bomb
231,Kloger,tt0397306,tt6834978,12,19,6.5,263.0,2017-08-21,2017,"
    Roger is lonely and unhappy as he thinks everyone but him has a stable relationship. Roger tries online dating and ends up on a date with Klaus, who is also looking for love. Klaus and Roger begin a passionate and secret affair, but Roger wants a more serious commitment. Meanwhile, Steve tries to get out of taking the Presidential Fitness Test.    ",American Dad!,Kloger
232,Garbage Stan,tt0397306,tt7160990,12,20,6.4,162.0,2017-08-28,2017,"
    The Smith family receives a notice that Grandpa Jack's storage unit is being auctioned away. Stan forbids the family from visiting the storage unit but Steve wants to learn more about Grandpa. Steve discovers a garbage truck in the unit and brings it to Stan. Stan has a few good memories of the truck so he and Steve start running the old garbage route. Steve learns that the truck was part of a drug running business but hides this from Stan. Meanwhile, Roger takes Hayley on the competitive bumper pool circuit.    ",American Dad!,Garbage Stan
233,The Talented Mr. Dingleberry,tt0397306,tt6834984,12,21,7.3,172.0,2017-09-04,2017,"
    Roger becomes a marionette and injures other students to help Steve win the school talent show.    ",American Dad!,The Talented Mr. Dingleberry
234,West to Mexico,tt0397306,tt6834986,12,22,7.2,168.0,2017-09-11,2017,"
    Stan, a wanted man on the run, finds himself in an Arizona town terrorized by Bullock and his clan.    ",American Dad!,West to Mexico
235,"Santa, Schmanta",tt0397306,tt7786664,13,1,6.2,157.0,2017-12-25,2017,"
    Roger converts to Judaism and tries to make Hanukkah more popular than Christmas.    ",American Dad!,"Santa, Schmanta"
236,Paranoid Frandroid,tt0397306,tt6212504,13,2,7.4,155.0,2018-02-12,2018,"
    Roger leads Francine into the twisted world of conspiracy theories; Steve and Klaus help Snot's family move into a new apartment.    ",American Dad!,Paranoid Frandroid
237,The Census of the Lambs,tt0397306,tt7787728,13,3,6.9,136.0,2018-02-19,2018,"
    Stan and Hayley compete in collecting data for the US Census; Klaus has Steve and his friends model for his new camera.    ",American Dad!,The Census of the Lambs
238,Shell Game,tt0397306,tt7787730,13,4,6.8,162.0,2018-02-26,2018,"
    Steve tries to stop Roger after he joins a mysterious order of birds' egg thieves; Francine buys a new Italian sauce.    ",American Dad!,Shell Game
239,The Mural of the Story,tt0397306,tt8000722,13,5,6.8,140.0,2018-03-05,2018,"
    Stan discovers that the Langley Falls historical mural has been ruined by graffiti, and convinces the town to allow him to restore it himself.    ",American Dad!,The Mural of the Story
240,(You Gotta) Strike for Your Right,tt0397306,tt8000724,13,6,6.6,133.0,2018-03-12,2018,"
    Hayley organises a strike in the C.I.A; The family watch Breaking Bad in reverse, and discover the show is hiding a scavenger hunt.    ",American Dad!,(You Gotta) Strike for Your Right
241,Klaustastrophe.tv,tt0397306,tt8000726,13,7,7.1,136.0,2018-03-19,2018,"
    Stan begins to experience crippling separation anxiety; Klaus builds a website and forces the family to participate.    ",American Dad!,Klaustastrophe.tv
242,Death by Dinner Party,tt0397306,tt8000728,13,8,7.7,141.0,2018-03-26,2018,"
    Francine hosts a dinner party, even though a serial killer who attacks dinner parties is terrorising the town.    ",American Dad!,Death by Dinner Party
243,The Never-Ending Stories,tt0397306,tt8039086,13,9,6.9,130.0,2018-04-09,2018,"
    Stan finds the CIA Academy cadets the perfect captive audience for his boring stories; Klaus becomes the hype-man for a famous rapper.    ",American Dad!,The Never-Ending Stories
244,Railroaded,tt0397306,tt8039094,13,10,6.5,121.0,2018-04-16,2018,"
    Frustrated with traffic, Stan proposes the town builds a bullet train; Roger pushes Stan to run for Mayor.    ",American Dad!,Railroaded
245,My Purity Ball and Chain,tt0397306,tt8039102,13,11,7.4,140.0,2018-04-23,2018,"
    When Steve starts acting out his sexual energy, Francine asks Stan to give him the talk, but he makes Steve join a creepy father-daughter celibacy club with him instead. Also, the family builds a water slide in the backyard.    ",American Dad!,My Purity Ball and Chain
246,OreTron Trail,tt0397306,tt8174858,13,12,7.7,126.0,2018-04-30,2018,"
    Traumatized by The Oregon Trail (1971), Roger becomes concerned about outliving the family, so he fakes his death, spoofs Renegade (1992) and traps the family in the game. Klaus opens a convenience store but becomes paranoid about shoplifters.    ",American Dad!,OreTron Trail
247,Mean Francine,tt0397306,tt8174864,13,13,7.1,121.0,2018-05-07,2018,"
    Francine falls in with a group of tough girls after becoming the new school guidance counselor.    ",American Dad!,Mean Francine
248,One-Woman Swole,tt0397306,tt8189178,13,14,,,2019-02-11,2019,"
    Francine becomes a bodybuilder; Klaus claims to have invented the high five.    ",American Dad!,One-Woman Swole
249,Flavortown,tt0397306,tt8189180,13,15,,,2019-02-18,2019,"
    Jeff hangs out with Stan's favorite celebrity chef while searching for an identity; Klaus and Roger start their own valet business.    ",American Dad!,Flavortown
250,Episode #13.16,tt0397306,tt8189186,13,16,,,,2019,"
  Know what this is about?
 Be the first one to add a plot.
    ",American Dad!,Episode #13.16
251,Episode #13.17,tt0397306,tt8189190,13,17,,,,2019,"
  Know what this is about?
 Be the first one to add a plot.
    ",American Dad!,Episode #13.17
252,Episode #13.18,tt0397306,tt8189192,13,18,,,,2019,"
  Know what this is about?
 Be the first one to add a plot.
    ",American Dad!,Episode #13.18
253,Episode #13.19,tt0397306,tt8189196,13,19,,,,2019,"
  Know what this is about?
 Be the first one to add a plot.
    ",American Dad!,Episode #13.19
254,Episode #13.20,tt0397306,tt8189200,13,20,,,,2019,"
  Know what this is about?
 Be the first one to add a plot.
    ",American Dad!,Episode #13.20
255,Episode #13.21,tt0397306,tt9109390,13,21,,,,2019,"
  Know what this is about?
 Be the first one to add a plot.
    ",American Dad!,Episode #13.21
256,Episode #13.22,tt0397306,tt9109392,13,22,,,,2019,"
  Know what this is about?
 Be the first one to add a plot.
    ",American Dad!,Episode #13.22
257,Episode #14.1,tt0397306,tt7860298,14,1,,,,,"
  Know what this is about?
 Be the first one to add a plot.
    ",American Dad!,Episode #14.1
258,Episode #15.1,tt0397306,tt7860308,15,1,,,,,"
  Know what this is about?
 Be the first one to add a plot.
    ",American Dad!,Episode #15.1
